artist_name,track_name,release_date,genre,lyrics
Sandy Denny,Who Knows Where the Time Goes,1967,folk,"Across the evening sky, all the birds are leaving But how can they know it's time for them to go? Before the winter fire, I shall still be dreaming I do not count the time For who knows where the time goes? Who knows where the time goes? Sad deserted shore, your fickle friends are leaving Oh, but then you know it's time for them to go But I shall still be here, I have no thought of leaving I have no thought of time For who knows where the time goes? Who knows where the time goes? And I am not alone while my love is near me And I know it shall be so until it's time to go So come the storms of winter and then the birds in spring again I do not fear the time For who knows how my love grows? And who knows where the time goes?"
Richard Thompson,Beeswing,1994,folk,"Well I was 21 years when I met a girl And she was just 16 Though the going got tough she was plenty rough She never treated me mean She was a rare thing, fine as a beeswing So fragile in the light And when I moved too fast she would hold me fast Like a moth in the pale moonlight We would laugh and talk and take our walks Beneath the pale moonlight And though I knew right well she was young and frail She never did treat me unkind She was a rare thing, fine as a beeswing So fragile in the light And when I moved too fast she would hold me fast Like a moth in the pale moonlight Oh the years flew by like a bird in the sky The summer days and the autumn eves And the frost it came and the ground grew hard And still we never would grieve She was a rare thing, fine as a beeswing So fragile in the light And when I moved too fast she would hold me fast Like a moth in the pale moonlight Well the winter it came and it rattled the panes And the wind it blew up a storm And she wrapped herself up in her shawl one day And left me alone and forlorn She was a rare thing, fine as a beeswing So fragile in the light And when I moved too fast she would hold me fast Like a moth in the pale moonlight So I would while away the hours and watch the flowers As they bloomed and died with the turning year And I would think of her beauty and how she could flutter And then she'd be gone, she'd disappear She was a rare thing, fine as a beeswing So fragile in the light And when I moved too fast she would hold me fast Like a moth in the pale moonlight"
John Prine,Angel from Montgomery,1971,folk,"I am an old woman named after my motherMy old man is another child that's grown oldIf dreams were lightning thunder'd past my window last nightLord I'd find us both gone in the morningWell, the years flow by like a broken down damLeaves on a river just passing throughI was once a young girl with my heart on fireAnd I stood right beside youWell, the years flow by like a broken down damLeaves on a river just passing throughI was once a young girl with my heart on fireAnd I stood right beside youHow the hell did I get here so fast?How the hell did I get here so fast?Long ago the feeling that I'm too old to have feelingsBut what the hell there's bound to be somebody for meYou know I had a dream about a trainWent so fast it frightened meCan't you see that it's all come trueAnd the years flow by like a broken down damLeaves on a river just passing throughI was once a young girl with my heart on fireAnd I stood right beside youHow the hell did I get here so fast?How the hell did I get here so fast?If dreams were lightning thunder'd past my window last nightLord I'd find us both gone in the morning"
Kris Kristofferson,Me and Bobby McGee,1969,folk,"Busted flat in Baton Rouge, headin' for the trains Feelin' nearly faded as my jeans Bobby thumbed a diesel down just before it rained Took us all the way to New Orleans     I pulled my harpoon out of my dirty red bandana I was playin' sad while Bobby sang the blues With them windshield wipers slappin' time and Bobby clappin' hands We finally sang up every song that driver knew     Freedom's just another word for nothin' left to lose Nothin', don't mean nothin' honey if it ain't free, no no And feelin' good was easy, Lord, when Bobby sang the blues And feelin' good was good enough for me Good enough for me and my Bobby McGee     From the Kentucky coal mines to the California sun Bobby shared the secrets of my soul Standin' right beside me through everything I've done Every night she kept me from the cold     Then somewhere near Salinas, Lord, I let her slip away She was lookin' for that home, and I hope she finds it But, I'd trade all of my tomorrows for a single yesterday To be holdin' Bobby's body next to mine     Freedom's just another word for nothin' left to lose Nothin', don't mean nothin' honey if it ain't free, no no And feelin' good was easy, Lord, when Bobby sang the blues And feelin' good was good enough for me Good enough for me and my Bobby McGee    La-da-da-da-da, la-da-da-da-da, hey, hey, hey La-da-da-da-da, la-da-da-da-da, Bobby McGee La-da-da-da-da, la-da-da-da-da, hey, hey, hey La-da-da-da-da, la-da-da-da-da, Bobby McGee Freedom's just another word for nothin' left to lose Nothin', don't mean nothin' honey if it ain't free, no no And feelin' good was easy, Lord, when Bobby sang the blues And feelin' good was good enough for me Good enough for me and my Bobby McGee    La-da-da-da-da, la-da-da-da-da, hey, hey, hey La-da-da-da-da, la-da-da-da-da, Bobby McGee La-da-da-da-da, la-da-da-da-da, hey, hey, hey La-da-da-da-da, la-da-da-da-da, Bobby McGee"
Townes Van Zandt,Pancho and Lefty,1972,folk,"Pancho was a bandit boys His horse was fast as polished steel He wore his gun outside his pants For all the honest world to feel Pancho was a bandit boys Hot as the desert sun They never knew which way he'd go No one could understand him    Lefty he was a salesman On the road most of the year He made an honest living boys For his wife and kids so dear Lefty he was a salesman But when his day was done He'd meet his friends at the local bar And talk about his days on the run Pancho met his match you know On the deserts dusty ground They say he didn't even see the shot He went down without a sound Lefty heard the word you know He was at the local bar They say he didn't shed a tear that day He just stared off at the stars Pancho met his match you know On the deserts dusty ground They say he didn't even see the shot He went down without a sound Lefty heard the word you know He was at the local bar They say he didn't shed a tear that day He just stared off at the stars The poets tell the story How Pancho and Lefty fell Lefty's living in a cheap hotel And Pancho's lying in a ditch The poets tell the story How Pancho and Lefty fell Lefty's living in a cheap hotel And Pancho's lying in a ditch"
Emmylou Harris,Boulder to Birmingham,1975,folk,"I would rock my baby in the cradle of the deep I would rock my baby in the cradle of the deep But I have no cradle And no baby to keep And it's a hard way to find out That trouble is real In a town full of strangers You don't know how you feel Sweet memories whisper Softly in my ear Sweet memories whisper Softly in my ear But they don't bring him back No they don't bring him here And it's a hard way to find out That trouble is real In a town full of strangers You don't know how you feel I went down to the river And I tried to drown my soul I went down to the river And I tried to drown my soul But the water was too shallow And the banks too cold And it's a hard way to find out That trouble is real In a town full of strangers You don't know how you feel Oh, the wheel keeps on turning And the world keeps on burning And it's a hard way to learn That the fire still burns And it's a hard way to find out That trouble is real In a town full of strangers You don't know how you feel I would rock my baby in the cradle of the deep I would rock my baby in the cradle of the deep But I have no cradle And no baby to keep"
Gillian Welch,Everything Is Free,2001,folk,"I never minded working hard It's mostly what I do But half of what I made Got swept away from view That's the way that it is That's the way that it goes And everything is free Everything is free Now the music is over But the money's all gone Was it worth it? I don't know That's the way that it is That's the way that it goes And everything is free Everything is free"
Iron & Wine,Naked as We Came,2004,folk,"She says Wake up, it's no use pretending I'll keep stealing, breathing her Birds are leaving over autumn's ending One of us will die inside these arms Eyes wide open Naked as we came One will spread our Ashes 'round the yard"
Sufjan Stevens,"John Wayne Gacy, Jr.",2005,folk,"His father was a drinker and his mother cried in bed Folding John Wayne's t-shirts when the swing set hit his head The neighbors, they adored him For his humor and his conversation Look underneath the house there Find the few living things, rotting fast, in their sleep Oh the dead Twenty-seven people Even more, they were boys, with their cars, summer jobs Oh my God Ooh, are you one of them? He dressed up like a clown for them With his face paint white and red And on his best behavior In a dark room on the bed he kissed them all He'd kill ten thousand people With a slight of his hand, running far, running fast to the dead He took off all their clothes for them He put a cloth on their lips, quiet hands, quiet kiss on the mouth"
Fleet Foxes,White Winter Hymnal,2008,folk,"I was following the pack all swallowed in their coats with wool scarves wound 'round my throat, and when I fell down to my knees that's the time that I saw you cry, I was following the pack all swallowed in their coats with wool scarves wound 'round my throat, and when I fell down to my knees that's the time that I saw you cry, White winter hymnal I was following the pack all swallowed in their coats with wool scarves wound 'round my throat, and when I fell down to my knees that's the time that I saw you cry, I was following the pack all swallowed in their coats with wool scarves wound 'round my throat, and when I fell down to my knees that's the time that I saw you cry, I was following the pack all swallowed in their coats with wool scarves wound 'round my throat, and when I fell down to my knees that's the time that I saw you cry"
The Decemberists,The Crane Wife 3,2006,folk,"She came to me one summer evening, with flowers in her hair, we spoke of lovers past and future, and things we could not share, she asked me of my childhood, I told her of my youth, and we made our vows beneath the branches, and I gave to her a golden tooth. Oh, the crane wife, oh, the crane wife, what have we done? We've made our bed beneath the branches, and now the morning's come. She bore to me a daughter, with hair as black as coal, and eyes like the summer sky, and a beauty to behold, but in the night I heard her weeping, and when I asked her why, she said, I cannot stay here, husband, for I am bound to fly. Oh, the crane wife, oh, the crane wife, what have we done? We've made our bed beneath the branches, and now the morning's come. I begged her, I implored her, I told her of my love, but she turned her gaze toward the heavens, like a wounded dove, she said, I must return now, to the place from whence I came, and she spread her wings and flew away, calling out my name. Oh, the crane wife, oh, the crane wife, what have we done? We've made our bed beneath the branches, and now the morning's come."
Damien Rice,Cannonball,2002,folk,"There's still a little bit of your taste in my mouth Still a little bit of you laced with my doubt It's still a little hard to say what's going on There's still a little bit of your ghost, your witness Still a little bit of your face I haven't kissed You step a little closer each day That I can't say what's going on Stones taught me to fly Love, it taught me to lie Life, it taught me to die So it's not hard to fall When you float like a cannonball There's still a little bit of your song in my ear There's still a little bit of your words I long to hear You step a little closer to me So close that I can't see what's going on Stones taught me to fly Love, it taught me to lie Life taught me to die So it's not hard to fall When you float like a cannon Stones taught me to fly Love, it taught me to cry So come on courage, teach me to be shy 'Cause it's not hard to fall And I don't wanna scare her It's not hard to fall And I don't wanna lose It's not hard to grow When you know that you just don't know"
José González,Heartbeats,2003,folk,"One night to be confused, one night to spend with you, now everything's changed in our little world, let's go driving in the pouring rain, and kiss me as we do when we undress, keep the curtains drawn 'cause all I wanna see is you and me and the streets of Gothenburg, 'cause we've got beating hearts, one night of magic rush, feels like this is starting of something, I've got you this moment, I'll spend it slow, 'cause you're all I want to see, let's go driving in the pouring rain, and kiss me as we do when we undress, keep the curtains drawn 'cause all I wanna see is you and me and the streets of Gothenburg, 'cause we've got beating hearts, one night of magic rush, feels like this is starting of something, I've got you this moment, I'll spend it slow, 'cause you're all I want to see, 'cause we've got beating hearts, one night of magic rush, feels like this is starting of something, I've got you this moment, I'll spend it slow, 'cause you're all I want to see"
The Tallest Man on Earth,Love Is All,2010,folk,"When the winter comes rolling in, and the summer's long gone with the wind; I will follow you into the dark again, and I will never let you go. When the mountains are cold and gray, and the rivers all freeze on their way; I will follow you into the dark again, and I will never let you go. Love is all, love is all, it will creep up on you and cover you whole; love is all, love is all, it will creep up on you and cover you whole. So put your weary head to rest, and let me kiss away all you detest; I will follow you into the dark again, and I will never let you go. When the city sleeps in its bed, and the lonely stars hang overhead; I will follow you into the dark again, and I will never let you go. Love is all, love is all, it will creep up on you and cover you whole; love is all, love is all, it will creep up on you and cover you whole."
Laura Marling,Rambling Man,2010,folk,"Well I am your rambling man, I'll walk across this land, Till I find the girl that I love, And I'll give her all my love, And I'll sing her pretty lies, And I'll take her by surprise, And I'll love her till she cries, But I am a rambling man. Well I am your rambling man, I'll walk across this land, Till I find the girl that I love, And I'll give her all my love, And I'll sing her pretty lies, And I'll take her by surprise, And I'll love her till she cries, But I am a rambling man. And I'll sing her pretty lies, And I'll take her by surprise, And I'll love her till she cries, But I am a rambling man. And I'll sing her pretty lies, And I'll take her by surprise, And I'll love her till she cries, But I am a rambling man. Well I am your rambling man, I'll walk across this land, Till I find the girl that I love, And I'll give her all my love, And I'll sing her pretty lies, And I'll take her by surprise, And I'll love her till she cries, But I am a rambling man. Well I am your rambling man, I'll walk across this land, Till I find the girl that I love, And I'll give her all my love, And I'll sing her pretty lies, And I'll take her by surprise, And I'll love her till she cries, But I am a rambling man."
The Lumineers,Ho Hey,2012,folk,"I've been trying to do it right, I've been living a lonely life, I've been sleeping here instead, I've been sleeping in my bed, So show me family, all the blood that I would bleed, I don't know where 1  you go but do you go at all?, Am I just a silly girl?, Is it dumb to feel like this?, Oh, oh, oh, oh, Oh, oh, oh, oh, I've been trying to do it right, I've been living a lonely life, I've been sleeping here instead, I've been sleeping in my bed, So show me family, all the blood that I would bleed, I don't know where 2  you go but do you go at all?, Am I just a silly girl?, Is it dumb to feel like this?, Oh, oh, oh, oh, Oh, oh, oh, oh, Ho!, Hey!"
Mumford & Sons,I Will Wait,2012,folk,"Well, I came home like a stone and I fell heavy into your loving arms; Now I don't wanna look them in the eye, I've been working so hard to avoid that for so long; Now I wanna cry and I wanna learn to love just like you; I wanna try and I wanna learn to love; I will wait, I will wait for you; And I would walk 500 miles and I would walk 500 more just to be at your door; When all is said and done, you'll walk right out into the sun; And I will wait, I will wait for you; And when all is said and done, you'll walk right out into the sun."
Hozier,Cherry Wine,2014,folk,"Her eyes and words are so icy, oh but she burns like rum on the fire, her clothes fall around her feet and she's laughin' like a child again, the world stops turnin', she's speakin' in tongues, movin' her body like it's the only one she's got, you are the finest thing yet to find, I don't know where I'm goin' but I know what I hope to find, oh, I think I've found it, I think I've found it, oh, I think I've found it, this is how it feels to be complete, the way she tells me I'm hers and she is mine, open my eyes and tell me I was dreaming, I was dreaming, oh, but she smells like sleep and lazy mornings, and never quite makes it to the shower, notes and melodies like butterflies, such tender days, the debit card and things you owe, you pick me up and take me home again, you are the sweetest thing that I know, could never get enough, I don't know where I'm goin' but I know what I hope to find, oh, I think I've found it, I think I've found it, oh, I think I've found it, this is how it feels to be complete."
First Aid Kit,Fireworks,2018,folk,"I get a kick out of the rain, how it washes everything away, makes way for something new, I get a kick out of the pain, how it sharpens every little thing, reminds me I'm still me, And I've been burning all my bridges down, watching them go up in smoke, higher and higher, Now there's nothing left to hold on to, no gentle hand to guide me home, I'm out here on my own, And I see fireworks from across the bay, they're beautiful but far away, like everything always seems to be these days, And I feel like a boat that's drifting out to sea, further and further from the shore, with no one there to rescue me, I used to think that I was strong, that I could make it on my own, but lately I'm not so sure, 'Cause the darkness gathers all around, and I can't seem to find my way, back to the light of day, And I see fireworks from across the bay, they're beautiful but far away, like everything always seems to be these days, And I feel like a boat that's drifting out to sea, further and further from the shore, with no one there to rescue me, Oh, the night is young and full of promise, but I'm just watching from a distance, wishing I was part of it all, And I see fireworks from across the bay, they're beautiful but far away, like everything always seems to be these days, And I feel like a boat that's drifting out to sea, further and further from the shore, with no one there to rescue me."
Gregory Alan Isakov,San Luis,2018,folk,"San Luis, you were good to me, the mountains high and the rivers wide, I will come back again, I will come back again. Oh, the train rolls by, and the wind blows free, and the sun shines down on you and me, I will come back again, I will come back again."
Brandi Carlile,The Joke,2018,folk,"Holding back tears while the sirens scream, every woman knows exactly what I mean; she was a riot, trying to hold it together, fighting with life and just barely getting through; but she learned to live with it, learned to love the rain, she could feel the healing coming; let 'em laugh while they can, let 'em spin, let 'em scatter in the wind; I have been to the movies, I've seen how it ends, and the joke's on 1  them; all of the underdogs in the world, a voice for the unloved ones, watching their ships come in; and they rise up, singing glory, glory, hallelujah, they rise up, singing glory, glory, amen; while they were laughing and dancing in the sand, and the world's still spinning 'round, he says, longer than there's been time; but she learned to live with it, learned to love the pain, she could feel the freedom coming; let 'em wonder what went wrong, let 'em whisper his name, then they'll be singing different someday; I have been to the movies, I've seen how it ends, and the joke's on them."
Phoebe Bridgers,Motion Sickness,2017,folk,"I have emotional motion sickness, somebody roll the windows down, There's no air in this car, I'm starting to choke up, And I don't know why I'm driving, I'm going nowhere, I didn't have a choice, But I didn't come this far to be this close to you, I'm going to see it through, I'm already sick of trying, If you'd have come to my show, you'd have seen a five-foot-nothing singer, With a bad case of the real big feelings, So I will try not to let it kill me, But thank you for the drugs, It really did me good, I'm feeling better now, I know you have to go, But I don't want you to, How about I drive? Oh, honey, I'm not afraid to die, I'm more afraid to fly, And the window's down and the AC's on, And I've got motion sickness, You made me feel like an idiot."
The Milk Carton Kids,Michigan,2013,folk,"Well I came to Michigan and it was cold and white, I came to Michigan in the middle of the night, I came to Michigan and the snow was on the ground, I came to Michigan but there was no one else around, I came to Michigan to see what I could see, I came to Michigan and Michigan saw me, I came to Michigan with winter in my bones, I came to Michigan and found that I was all alone, Oh Michigan, Oh Michigan, your lakes are cold and deep, Oh Michigan, Oh Michigan, you keep my love asleep, Well I came to Michigan and the trees were tall and bare, I came to Michigan but my love was not there, I came to Michigan with springtime in my heart, I came to Michigan but we were worlds apart, Oh Michigan, Oh Michigan, your winds blow through the trees, Oh Michigan, Oh Michigan, you took my love from me, Well I came to Michigan when summer days were long, I came to Michigan but my heart did not belong, I came to Michigan when autumn leaves did fall, I came to Michigan but I did not stay at all, Oh Michigan, Oh Michigan, your colors fade too soon, Oh Michigan, Oh Michigan, beneath your harvest moon."
Mandolin Orange,Wildfire,2016,folk,"Brave men fought with the battle cry Tears filled the eyes of their loved ones and their brothers in arms And so it went, for Joseph Warren It should have been different It could have been easy His rank could have saved him But a country unborn needs bravery And it spread like wildfire From the ashes grew sweet liberty Like the seeds of the pines when the forest burns They open up to grow and burn again It should have been different It could have been easy But too much money rolled in to ever end slavery The cry for war spread like wildfire Civil War came, Civil War went Brother fought the brother, the South was spent But its true demise was hatred passed down through the years It should have been different It could have been easy But pride has a way of holding too firm to history And it burns like wildfire I was a born a southern son In a small southern town where the rebels run wild They beat their chests and they swear we're going to rise again It should have been different It could have been easy The day that old Warren died hate should have gone with him But here we are caught in the wildfire"
The Oh Hellos,Hello My Old Heart,2012,folk,"Well hello my old heart, how you been? We've been spending some time apart, but now the season's coming in. And I hear the birds begin to sing, but they don't sound like anything. I've heard before, no they don't sound like anything I've heard before. Well hello my old heart, what's been wrong? You've been quiet since way too long, but now the silence feels too strong. And I feel the years begin to weigh, and I wonder what my friends would say. If they could see me now, yeah I wonder what my friends would say if they could see me now. But I'm coming home, I'm coming home, tell the world that I'm coming home. Let the sun beat down upon my face, stars to fill my dreams. I'm coming home, I'm coming home, tell the world that I'm coming home."
The Paper Kites,Bloom,2010,folk,"Sweetheart, I was wrong to try and make you be like me, I can't deny the way that you were born to be, In the morning light, the city wakes although I know you never sleep, The gentle pull and then the sudden shock, Oh, the misery, the misery, the misery of it all, I buried you beneath the garden stones that weep, The flowers bloom like madness in the spring, I feel you in the rustling of my sheets, And I know you're in the arms of someone else, It's a cruel, cruel summer leaving like a fawn, Oh, the misery, the misery, the misery of it all, And I would beg for you to stay, but you've already gone, I feel you in the beating of my heart, And I know you're in the arms of someone else, It's a cruel, cruel summer leaving like a fawn, Oh, the misery, the misery, the misery of it all, And I would beg for you to stay, but you've already gone, I feel you in the beating of my heart, And I know you're in the arms of someone else, It's a cruel, cruel summer leaving like a fawn, Oh, the misery, the misery, the misery of it all, And I would beg for you to stay, but you've already gone."
