artist_name,track_name,release_date,genre,lyrics
Woody Guthrie,This Land Is Your Land,1944,folk,"This land is your land, this land is my land, from California to the New York island, from the redwood forest to the Gulf Stream waters; this land was made for you and me." 
Pete Seeger,If I Had a Hammer,1949,folk,"If I had a hammer, I'd hammer in the morning, I'd hammer in the evening, all over this land; I'd hammer out danger, I'd hammer out a warning, I'd hammer out love between my brothers and my sisters, all over this land."
Lead Belly,"Goodnight, Irene",1933,folk,"I asked your mother for you, She told me that you was too young, I wish dear Lord that I'd never seen your face, I'm sorry you ever were born, Irene good night, Irene good night, Good night Irene and good night Irene, I guess you're in my dreams, Sometimes I live in the country, Sometimes I live in town, Sometimes I have a great notion, Jumping in, into the river and drown, Irene good night, Irene good night, Good night Irene and good night Irene, I guess you're in my dreams, Stop ramblin' and stop gamblin', Quit staying out late at night, Go home to your wife and your family, Stay there by the fireside bright, Irene good night, Irene good night, Good night Irene and good night Irene, I guess you're in my dreams, I love Irene, God knows I do, I love her 'til the sea runs dry, If Irene turns her back on me, I'm gonna take morphine and die"
Elizabeth Cotten,Freight Train,1958,folk,"Freight train, freight train, run so fast Freight train, freight train, run so fast Please don't tell what train I'm on They won't know what route I'm going When I'm dead and in my grave No more good times here I crave Place the stones at my head and feet And tell them all I've gone to sleep When I die, oh bury me deep Down at the end of old Chestnut Street So I can hear old Number Nine As she comes rolling by When I die, oh bury me deep Down at the end of old Chestnut Street Place the stones at my head and feet And tell them all I've gone to sleep Freight train, freight train, run so fast Freight train, freight train, run so fast Please don't tell what train I'm on They won't know what route I'm going"
Malvina Reynolds,Little Boxes,1962,folk,"Little boxes on the hillside Little boxes made of ticky-tacky Little boxes on the hillside Little boxes all the same There's a green one and a pink one And a blue one and a yellow one And they're all made out of ticky-tacky And they all look just the same And the people in the houses All went to the university Where they were put in boxes And they came out all the same And there's doctors and lawyers And business executives And they're all made out of ticky-tacky And they all look just the same And they all play on the golf course And drink their martinis dry And they all have pretty children And the children go to school And the children go to summer camp And then to the university Where they are put in boxes And they come out all the same And the boys go into business And marry and raise a family In boxes made of ticky-tacky And they all look just the same There's a pink one and a green one And a blue one and a yellow one And they're all made out of ticky-tacky And they all look just the same"
Tim Hardin,If I Were a Carpenter,1966,folk,"If I were a carpenter And you were a lady Would you marry me anyway? Would you have my baby? If a tinker were my trade Would you still find me Carrying the pots I made Following behind me? Save my love for sorrow Save my love for lonely I've given you my tomorrow Love me only If I worked my hands in wood Would you still love me? Answer me quick, Tim, I could I'll put you above me If I were a miller At a mill wheel grinding Would you miss your colored blocks Soft shoes and shining? Save my love through loneliness Save my love for sorrow I've given you my onlyness Give me your tomorrow If I were a carpenter And you were a lady Would you marry me anyway? Would you have my baby?"
Bill Monroe,Blue Moon of Kentucky,1947,folk,"Blue moon of Kentucky, keep on shinin' Shine on the one that's gone and proved untrue Blue moon of Kentucky, keep on shinin' Shine on the one that's gone and left me blue It was on a moonlit night The stars were shinin' bright And they whispered from on high Your love has said goodbye Blue moon of Kentucky, keep on shinin' Shine on the one that's gone and said, Goodbye Blue moon of Kentucky, keep on shinin' Shine on the one that's gone and proved untrue Blue moon of Kentucky, keep on shinin' Shine on the one that's gone and left me blue It was on a moonlit night The stars were shinin' bright And they whispered from on high Your love has said goodbye Blue moon of Kentucky, keep on shinin' Shine on the one that's gone and said, Goodbye"
Hedy West,500 Miles,1961,folk,"If you miss the train I'm on You will know that I am gone You can hear the whistle blow a hundred miles! A hundred miles A hundred miles A hundred miles A hundred miles You can hear the whistle blow a hundred miles! If my honey said so I'd railroad no more I'd sidetrack my engine and go home! And go home And go home And go home And go home I'd sidetrack my engine and go home! Lord, I'm one, Lord, I'm two Lord, I'm three, Lord, I'm four Lord, I'm five hundred miles away from home! Away from home Away from home Away from home Away from home Lord, I'm five hundred miles away from home! I told my little letter Just as plain as I could tell her She'd better come along and go with me! Go with me Go with me Go with me Go with me She'd better come along and go with me! My clothes are all worn My shoes are all torn Lord, I can't make a living this a-way! This-a way This-a way This-a way This-a way Lord, I can't make a living this a-way! If this train runs me right I'll be back tomorrow night I'm coming down the line on number nine! Number nine Number nine Number nine Number nine For I'm coming down the line on number nine! Not a shirt on my back Not a penny to my name Lord I can't go back home this a-way! This-a way This-a way This-a way This-a way Lord I can't go back home this a-way! If you miss the train I'm on You will know that I am gone You can hear the whistle blow a hundred miles! A hundred miles A hundred miles A hundred miles A hundred miles You can hear the whistle blow a hundred miles!"
Mississippi John Hurt,Candy Man,1928,folk,"Well all you ladies gather 'round That good sweet candy man's in town It's the candy man It's the candy man He likes a stick of candy just nine inch long He sells as fast 'a hog can chew his corn It's the candy man It's the candy man All heard what sister Johnson said She always takes a candy stick to bed It's the candy man It's the candy man Don't stand close to the candy man He'll leaves a big candy stick in your hand It's the candy man It's the candy man He sold some candy to sister Bad The very next day she took all he had It's the candy man It's the candy man If you try his candy, good friend of mine You sure will want it for a long long time It's the candy man Sweet candy man His stick candy don't melt away It just gets better, so the ladies say It's the candy man It's the candy man"
Harry McClintock,Big Rock Candy Mountain,1928,folk,"One evening as the sun went down And the jungle fire was burning Down the track came a hobo hikin' And he said, Boys, I'm not turning I'm headed for a land that's far away Beside the crystal fountains So come with me, we'll go and see The Big Rock Candy Mountains In The Big Rock Candy Mountains There's a land that's fair and bright Where the handouts grow on bushes And you sleep out every night Where the boxcars all are empty And the sun shines every day On the birds and the bees and the cigarette trees The lemonade springs where the bluebird sings In The Big Rock Candy Mountains In The Big Rock Candy Mountains All the cops have wooden legs And the bulldogs all have rubber teeth And the hens lay soft-boiled eggs The farmers' trees are full of fruit And the barns are full of hay Oh I'm bound to go where there ain't no snow Where the rain don't fall, the wind don't blow In The Big Rock Candy Mountains In The Big Rock Candy Mountains You never change your socks And the little streams of alcohol Come a-trickling down the rocks The brakemen have to tip their hats And the railroad bulls are blind There's a lake of stew and of whiskey, too You can paddle all around 'em in a big canoe In The Big Rock Candy Mountains In The Big Rock Candy Mountains The jails are made of tin And you can walk right out again As soon as you are in There ain't no short-handle shovels No axes, saws or picks I'm a-goin' to stay where you sleep all day Where they hung the jerk that invented work In The Big Rock Candy Mountains I'll see you all this comin' fall In the Big Rock Candy Mountains"
Doc Watson,Deep River Blues,1964,folk,"Let it rain, let it pour Let it rain, a whole lot more 'Cause I got them deep river blues Let the rain drive right on Let the wave sweep along 'Cause I got them deep river blues My old girl is a good old pal And she looks like a waterfowl When I get them deep river blues There ain't no one to cry for me And the fish all go out on a spree When I get them deep river blues Give me back my old boat I'm gonna sail if she'll float 'Cause I got them deep river blues I'm goin' back to Muscle Shoals Times are better there I'm told 'Cause I got them deep river blues Let it rain, let it pour And let it rain a whole lot more 'Cause I got them deep river blues Let the rain drive right on Let the wave sweep along 'Cause I got them deep river blues If my boat sinks with me I'll go down, don't you see? 'Cause I got them deep river blues Now I'm gonna say goodbye And if I sink, just let me die 'Cause I got them deep river blues Let it rain, let it pour Let it rain a whole lot more 'Cause I got them deep river blues Let the rain drive right on Let the wave sweep along 'Cause I got them deep river blues"
Jackson C. Frank,Blues Run the Game,1965,folk,"Catch a boat to England, baby Maybe to Spain Wherever I have gone Wherever I've been and gone Wherever I have gone The blues are all the same Send out for whisky, baby Send out for gin Me and room service, honey Me and room service, babe Me and room service Well, we're"
Nick Drake,Pink Moon,1972,folk,"Saw it written and I saw it say Pink moon is on its way And none of you stand so tall Pink moon gonna get ye all And it's a pink moon Hey, it's a pink moon Pink, pink, pink, pink, pink moon Pink, pink, pink, pink, pink moon I saw it written and I saw it say A pink moon is on its way And none of you stand so tall Pink moon gonna get ye all It's a pink moon Yeah, it's a pink moon"
Cat Stevens,Wild World,1970,folk,"Now that I've lost everything to you you say you wanna start something new and it's breakin' my heart you're leavin' baby, I'm grievin' but if you wanna leave take good care 1  hope you have a lot of nice things to wear but then a lot of nice things turn bad out there oh baby baby it's a wild world it's hard to get by just upon a smile 2  oh baby baby it's a wild world I'll always remember you like a child girl you know I've seen a lot of what the world can do and it's breakin' 3  my heart in two 'cause I never want to see you sad girl don't be a bad girl but if you wanna leave take good care hope you make a lot of nice friends 4  out there but just remember there's a lot of bad and beware beware oh baby baby it's a wild world 5  it's hard to get by just upon a smile oh baby baby it's a wild world and I'll always remember you like a child girl baby I love you but if you wanna leave take good care hope 6  you make a lot of nice friends out there but just remember there's a lot of bad and beware beware 7  oh baby baby it's a wild world it's hard to get by just upon a smile oh baby baby it's a wild world and I'll always remember you like a child 8  girl"
Steve Goodman,City of New Orleans,1971,folk,"Riding on the City of New Orleans, Illinois Central Monday morning rail, fifteen cars and fifteen restless riders, three conductors and twenty-five sacks of mail. All along the southbound odyssey the train pulls out at Kankakee, rolls along past houses, farms, and fields. Passing 1  towns that have no name, freight yards full of old black men, and 2  a graveyard of rusted automobiles. Good morning, America, how are you? Say, don't you know me? I'm your native son. I'm the train they call the City of New Orleans, and I'll be gone five hundred miles when the day is done"
Gordon Lightfoot,Early Morning Rain,1966,folk,"In the early morning rain, with a lifetime on my mind. Couldn't find a better way to leave the woman behind. Couldn't find a better way to leave the woman behind. On a downtown bound train, loaded up with pain. Leaving Louisiana, heading for the coast. Wide awake and cold, listening to the stories told. Seems the same old song, a long way from home. In the early morning rain, with a lifetime on my mind. Never thought she'd leave me, never thought she'd leave me behind. Never thought she'd leave me, never thought she'd leave me behind. Train whistle blows, a sad and lonely sound. I'm a hundred miles away from home, and I'm downtown bound. Wide awake and cold, listening to the stories told. Seems the same old song, a long way from home. In the early morning rain, with a lifetime on my mind. Never thought she'd leave me, never thought she'd leave me behind. Never thought she'd leave me, never thought she'd leave me behind."
Leonard Cohen,Suzanne,1967,folk,"Suzanne takes you down to her place near the river, you can hear the boats go by, you can spend the night beside her. And you know that she's half crazy but that's why you want to be there and she feeds you tea and oranges that come all the way from China. And just when you mean to tell her that you have no love to give her, 1  she gets you on her wavelength and she lets the river answer that you've always been her lover. And you want to travel with her, and you want to travel blind, and you know that she will trust you for you've touched her perfect body with your mind. 2  And Jesus was a sailor when he walked upon the water and he spent a long time watching from his lonely wooden tower. And when he knew for certain only drowning men could see him he said All men will be sailors then until the sea shall free them. But he himself was broken long before the sky would open, forsaken, almost human, he sank beneath your wisdom like a stone. 3  And you want to travel with him, and you want to travel blind, and you know that he will trust you for you've touched his perfect body with your mind. 4  Suzanne takes you down to her place near the river and she is wearing rags and feathers from Salvation Army counters. And the sun pours down like honey on our lady of the harbor and she shows you where to look among the garbage and the flowers. 5  There are heroes in the seaweed there are children in the morning they are leaning out for love and they will lean that way forever. 6  While Suzanne holds your hand and you want to travel with her and you want to travel blind and you know that she will trust you for you've touched her perfect body with your mind"
Ian & Sylvia,Four Strong Winds,1963,folk,"Four strong winds that blow lonely, seven lonely days and nights. Four strong winds that blow lonely, seven lonely days and nights. You were on my mind, you were on my mind. You were on my mind, you were on my mind. If I get there before you do, I'll look for you in the early morning sun. If I get there before you do, I'll look for you in the early morning sun. And if I don't see you when I come, I'll sit and wait for you till the evening comes. And if I don't see you when I come, I'll sit and wait for you till the evening comes. Four strong winds that blow lonely, seven lonely days and nights. Four strong winds that blow lonely, seven lonely days and nights. You were on my mind, you were on my mind. You were on my mind, you were on my mind."
Tom Paxton,The Last Thing on My Mind,1964,folk,"Yesterday is dead and gone and tomorrow's out of sight. And it's sad to be alone but it's not the hardest thing in life. What I want is what I've not got but what I need is all around. What I want is what I've not got but what I need is all around. So I'll take my time and I'll take a train. I'll take a plane and I'll take a boat. I'll take a bus and I'll take a car. I'll take a horse and I'll take a goat. What I want is what I've not got but what I need is all around. What I want is what I've not got but what I need is all around. So I'll take my time and I'll take a train. I'll take a plane and I'll take a boat. I'll take a bus and I'll take a car. I'll take a horse and I'll take a goat. What I want is what I've not got but what I need is all around. What I want is what I've not got but what I need is all around."
The Kingston Trio,Where Have All the Flowers Gone,1961,folk,"Where have all the flowers gone, long time passing? Where have all the flowers gone, long time ago? Where have all the flowers gone, young girls picked them everyone. 1  Oh, when will they ever learn? Oh, when will they ever learn? Where have all the young girls gone, long time passing? Where have all the young girls gone, long 2  time ago? Where have all the young girls gone, 3  they've taken husbands everyone. Oh, when will they ever learn? Oh, when will they ever learn? Where have all the husbands gone, long time passing? Where have all the husbands gone, long time ago? Where have all the 4  husbands gone, they've gone to soldiers everyone. Oh, when will they ever learn? Oh, when will they ever learn? Where have all the soldiers gone, long time passing? Where have all the soldiers gone, long time 5  ago? Where have all the soldiers gone, 6  they're all in graveyards everyone. Oh, when will they ever learn? Oh, when will they ever learn? Where have all the graveyards gone, long time passing? Where have all the graveyards gone, long 7  time ago? Where have all the graveyards gone, they're covered with flowers 8  everyone. Oh, when will they ever learn? Oh, when will they ever learn?"
Joan Baez,Diamonds & Rust,1975,folk,"Now the years are rolling by me They are rockin' evenly I can see you clear as day Though you've been away so long I can't do more than say Hello, stranger, it's been a while And I've seen a lot of changes In the way we've rearranged it I can see you clear as day Though you've been away so long I can't do more than say Hello, stranger, it's been a while And the years have rolled around me Like a blanket of the sea I can see you clear as day Though you've been away so long I can't do more than say Hello, stranger, it's been a while"
Odetta,Midnight Special,1956,folk,"Well, you wake up in the morning, hear the ding dong ring Ya go marching to the table, ya see the same old things All on one table, knife, a fork and a pan And it ya say a thing about it, you're in trouble with the man Oh, let the Midnight Special shine her light on me Let the Midnight Special shine her ever loving light on me Oh, if you ever go to Houston, ya better walk right Ya better not stagger, you'd better not fight Sheriff he'll arrest you, he'll carry ya down And if the jury finds ya guilty, you're penitentiary bound Oh, let the Midnight Special shine her light on me Let the Midnight Special shine her ever loving light on me O yonder comes Miss Rosie! How in the world do ya know? Well, I knowed her by her apron and the dress she wore Umbrella on her shoulder, a piece of paper in her hand She goes a walking to the captain, said, Turn loose my man Oh, let the Midnight Special shine her light on me Let the Midnight Special shine her ever loving light on me"
Buffy Sainte-Marie,Universal Soldier,1964,folk,"Though many years have come and gone, his song will still live on. The story of a brave young man is known to all. And his name was called the universal soldier. And his name was called the universal soldier. And he was just seventeen, when he went off to war. And he'd never seen a gun before, he'd never seen a gun before. And he was just seventeen, when he went off to war. And he'd never seen a gun before, he'd never seen a gun before. And he'd never seen a gun before. And he was just seventeen, when he went off to war. And he'd never seen a gun before, he'd never seen a gun before. And he was just seventeen, when he went off to war. And he'd never seen a gun before, he'd never seen a gun before. And he'd never seen a gun before. And he was just seventeen, when he went off to war. And he'd never seen a gun before, he'd never seen a gun before. And he was just seventeen, when he went off to war. And he'd never seen a gun before, he'd never seen a gun before. And he'd never seen a gun before. And he was just seventeen, when he went off to war. And he'd never seen a gun before, he'd never seen a gun before. And he was just seventeen, when he went off to war. And he'd never seen a gun before, he'd never seen a gun before. And he'd never seen a gun before. And he was just seventeen, when he went off to war. And he'd never seen a gun before, he'd never seen a gun before. And he was just seventeen, when he went off to war. And he'd never seen a gun before, he'd never seen a gun before. And he'd never seen a gun before. And he was just seventeen, when he went off to war. And he'd never seen a gun before, he'd never seen a gun before. And he was just seventeen, when he went off to war. And he'd never seen a gun before, he'd never seen a gun before. And he'd never seen a gun before. And he was just seventeen, when he went off to war. And he'd never seen a gun before, he'd never seen a gun before. And he was just seventeen, when he went off to war. And he'd never seen a gun before, he'd never seen a gun before. And he'd never seen a gun before. And he was just seventeen, when he went off to war. And he'd never seen a gun before, he'd never seen a gun before. And he was just seventeen, when he went off to war. And he'd never seen a gun before, he'd never seen a gun before. And he'd never seen a gun before. And he was just seventeen, when he went off to war. And he'd never seen a gun before, he'd never seen a gun before. And he was just"
Arlo Guthrie,Alice's Restaurant Massacree,1967,folk,"You can get anything you want at Alice's Restaurant, Alice's Restaurant, you can get anything you want at Alice's Restaurant. Walk right in it's around the back, just a half a mile from 1  the railroad track. You can get anything you want at Alice's Restaurant. Now 2  folks, if you want to join our parade."
Fairport Convention,Matty Groves,1969,folk,"A holiday, a holiday, the first of May I went down to Stanesfield to see the garland gay When who should I espy there but my own wedded lord Sitting drinking wine with another man's whore How could you leave me, how could you slight me To sit drinking wine with another man's lady? He said, Hold your tongue, woman, and talk not so wild For I mean to lie with her, and that's no child If you mean to lie with her, and that's your intent Then you'll never lie with me again, until your dying day is spent She walked and she walked till she came to his bower And she called unto his men so loud Is your lord within? she said, or may I come in? They said, Our lord's within, but he's in bed with a woman How could you leave me, how could you slight me To sit drinking wine with another man's lady? He said, Hold your tongue, woman, and talk not so wild For I mean to lie with her, and that's no child If you mean to lie with her, and that's your intent Then you'll never lie with me again, until your dying day is spent She walked and she walked till she came to his bower And she called unto his men so loud Is your lord within? she said, or may I come in? They said, Our lord's within, but he's in bed with a woman She tripped up the stairs and the doors she did break And who should she find but Matty Groves lying fast asleep And her own wedded lord standing close by his side And a bright shining sword that was bloody to the hilt How do you like my bed? she said, how do you like my sheets? And how do you like the fair pretty girl that lies in your arms asleep? It is well, it is well, Matty Groves he did say Though I'd gladly fight with thee, if I only had the day Get up, get up, Matty Groves, she said, and put on your clothes For it never shall be said that I killed a naked man He put on his clothes and he came downstairs And he fought with her lord for three hours and more But Matty Groves was a brave young man, and a squire of renown And he fought with her lord till the blood did run down But her lord was a treacherous knave, and a cowardly hound And he watched for his chance, and he wounded Matty Groves Oh rise you up, Matty Groves, she said, and take your death wound free For it's better I should have one kiss from your lips than you should have twenty from me Oh rise you up, Matty Groves, she said, and take your death wound free For it's better I should have one kiss from your lips than you should have twenty from me She picked him up in her arms, and she carried him to the stable door And as the blood ran down, she cried, Matty Groves, no more She picked him up in her arms, and she carried him to the stable door And as the blood ran down, she cried, Matty Groves, no more"
